ID,Title,Author
532,Intra- and extra-euro area import demand for manufactures,"Anderton, Robert & Skudelny, Frauke & Baltagi, Badi H. & Sousa, Nuno"
531,"Market power, innovative activity and exchange rate pass-through in the euro area","Brissimis, Sophocles N. & Kosma, Theodora"
530,Cross-dynamics of volatility term structures implied by foreign exchange options,"Vähämaa, Sami & Krylova, Elizaveta & Nikkinen, Jussi"
529,Explaining exchange rate dynamics: the uncovered equity return parity condition,"Cappiello, Lorenzo & De Santis, Roberto A."
528,How successful are exchange rate communication and interventions? Evidence from time-series and event-study approaches,"Fratzscher, Marcel"
527,Banking system stability: a cross-Atlantic perspective,"Hartmann, Philipp & Straetmans, Stefan & de Vries, Casper"
526,On some fiscal effects on mortgage debt growth in the EU,"Wolswijk, Guido"
525,Distilling co-movements from persistent macro and financial series,"Abadir, Karim & Talmain, Gabriel"
524,Price setting in the euro area: some stylized facts from individual consumer price data,"Hoffmann, Johannes & Jonker, Nicole & Lünnemann, Patrick & Vilmunen, Jouko & Dhyne, Emmanuel & Dias, Daniel & Le Bihan, Hervé & Álvarez, Luis J. & Veronese, Giovanni & Rumler, Fabio"
523,How frequently do consumer prices change in Austria? Evidence from micro CPI data,"Baumgartner, Josef & Glatzer, Ernst & Rumler, Fabio & Stiglbauer, Alfred"
522,Price setting behaviour in Spain: evidence from micro PPI data,"Hernando, Ignacio & Álvarez, Luis J. & Burriel, Pablo"
521,Inflation persistence in structural macroeconomic models (RG10),"Berben, Robert-Paul & Mestre, Ricardo & Mitrakos, Theodoros & Morgan, Julian & Zonzilos, Nikolaos G."
520,Delegated portfolio management: a survey of the theoretical literature,"Stracca, Livio"
519,Non-Keynesian effects of fiscal contraction in new member states,"Rzońca, Andrzej & Ciżkowicz, Piotr"
518,Term structure and the sluggishness of retail bank interest rates in euro area countries,"Mojon, Benoît & Valla, Natacha & de Bondt, Gabe"
517,Credit ratings and the standardised approach to credit risk in Basel II,"Van Roy, Patrick"
516,The European Monetary Union as a commitment device for new EU member states,"Ravenna, Federico"
515,"An international analysis of earnings, stock prices and bond yields","Durré, Alain & Giot, Pierre"
514,Gains from international monetary policy coordination: does it pay to be different?,"Liu, Zheng & Pappa, Evi"
513,Does government spending crowd in private consumption? Theory and empirical evidence for the euro area,"Coenen, Günter & Straub, Roland"
512,Counterfeiting and inflation,"Monnet, Cyril"
511,Time or state dependent price setting rules? Evidence from Portuguese micro data,"Robalo Marques, Carlos & Dias, Daniel & Santos Silva, João M. C."
510,Factor analysis in a New-Keynesian model,"Beyer, Andreas & Farmer, Roger E. A. & Henry, Jérôme & Marcellino, Massimiliano"
509,"Productivity shocks, budget deficits and the current account","Fratzscher, Marcel & Müller, Gernot J. & Bussière, Matthieu"
508,Systemic risk in alternative payment system designs,"Galos, Peter & Soramäki, Kimmo"
507,"Incorporating a ""public good factor"" into the pricing of large-value payment systems","Holthausen, Cornelia & Rochet, Jean-Charles"
506,Settlement finality as a public good in large-value payment systems,"Humphrey, David & Pagès, Henri"
505,"Public good issues in TARGET: natural monopoly, scale economies, network effects and cost allocation","Bolt, Wilko & Humphrey, David"
504,Monetary policy predictability in the euro area: an international comparison,"Zaghini, Andrea & Wilhelmsen, Björn-Roger"
503,World trade and global integration in production processes: a re-assessment of import demand equations,"Barrell, Ray & Dées, Stéphane"
502,Fiscal and monetary rules for a currency union,"Ferrero, Andrea"
501,Measuring comovements by regression quantiles,"Cappiello, Lorenzo & Manganelli, Simone & Gérard, Bruno"
500,Fleshing out the monetary transmission mechanism: output composition and the role of financial frictions,"Müller, Gernot J. & Meier, André"
499,A trend-cycle(-season) filter,"Mohr, Matthias"
498,Financial integration and entrepreneurial activity: evidence from foreign bank entry in emerging markets,"Giannetti, Mariassunta & Ongena, Steven"
497,Early-warning tools to forecast general government deficit in the euro area: the role of intra-annual fiscal indicators,"Pérez, Javier J."
496,Estimates of the open economy New Keynesian Phillips curve for euro area countries,"Rumler, Fabio"
495,Measuring inflation persistence: a structural time series approach,"Dossche, Maarten & Everaert, Gerdie"
494,Cross-country efficiency of secondary education provision: a semi-parametric analysis with non-discretionary inputs,"Afonso, António & St. Aubyn, Miguel"
493,Optimal research in financial markets with heterogeneous private information: a rational expectations model,"Tinn, Katrin"
492,Experimental evidence on the persistence of output and inflation,"Adam, Klaus"
491,On the fit and forecasting performance of New-Keynesian models,"Smets, Frank & Wouters, Raf & Del Negro, Marco & Schorfheide, Frank"
490,"Unions, wage setting and monetary policy uncertainty","Grüner, Hans Peter & Hayo, Bernd & Hefeker, Carsten"
489,Persistence and nominal inertia in a generalized Taylor economy: how longer contracts dominate shorter contracts,"Dixon, Huw & Kara, Engin"
488,"Communication and decision-making by central bank committees: different strategies, same effectiveness?","Ehrmann, Michael & Fratzscher, Marcel"
487,Computing second-order-accurate solutions for rational expectation models using linear solution methods,"Sutherland, Alan & Lombardo, Giovanni"
486,What drives productivity growth in the new EU member states? The case of Poland,"Kolasa, Marcin"
485,Corporate investment and cash flow sensitivity: what drives the relationship?,"Vermeulen, Philip & Mizen, Paul"
484,Fiscal federalism and public inputs provision: vertical externalities matter,"Martí­nez-López, Diego"
483,Money supply and the implementation of interest rate targets,"Schabert, Andreas"
482,Forecasting macroeconomic variables for the new member states of the European Union,"Marcellino, Massimiliano & Banerjee, Anindya & Masten, Igor"
481,Output and inflation responses to credit shocks: are there threshold effects in the euro area?,"Calza, Alessandro & Sousa, João"
480,Insurance policies for monetary policy in the euro area,"Wieland, Volker & Kuester, Keith"
479,The performance and robustness of interest-rate rules in models of the euro area,"Adalid, Ramón & Coenen, Günter & McAdam, Peter & Siviero, Stefano"
478,The conquest of U.S. inflation: learning and robustness to model uncertainty,"Sargent, Thomas J. & Cogley, Timothy"
477,Parameter misspecification and robust monetary policy rules,"Walsh, Carl E."
476,Monetary policy with judgment: forecast targeting,"Svensson, Lars E. O."
475,Monetary policy analysis with potentially misspecified models,"Del Negro, Marco & Schorfheide, Frank"
474,Calvo pricing and imperfect common knowledge: a forward looking model of rational inflation inertia,"Nimark, Kristoffer P."
473,Fiscal consolidations in the Central and Eastern European countries,"Afonso, António & Nickel, Christiane & Rother, Philipp"
472,Yield curve prediction for the strategic investor,"Bernadell, Carlos & Coche, Joachim & Nyholm, Ken"
471,Real wages and local unemployment in the euro area,"Sanz de Galdeano, Anna & Turunen, Jarkko"
470,Structural filters for monetary analysis: the inflationary movements of money in the euro area,"Bruggeman, Annick & Camba-Méndez, Gonzalo & Fischer, Björn & Sousa, João"
469,Money and prices in models of bounded rationality in high inflation economies,"Marcet, Albert & Nicolini, Juan Pablo"
468,Endogeneities of optimum currency areas: what brings countries sharing a single currency closer together?,"Mongelli, Francesco Paolo & De Grauwe, Paul"
467,Socio-economic development and fiscal policy: lessons from the cohesion countries for the new member states,"Mehrotra, Aaron N. & Peltonen, Tuomas"
466,Regulated and services' prices and inflation persistence,"Lünnemann, Patrick & Mathä, Thomas Y."
465,Determinants and consequences of the unification of dual-class shares,"Pajuste, Anete"
464,The price-setting behavior of Austrian firms: some survey evidence,"Kwapil, Claudia & Baumgartner, Josef & Scharler, Johann"
463,Break in the mean and persistence of inflation: a sectoral analysis of French CPI,"Bilke, Laurent"
462,Time-dependent versus state-dependent pricing: a panel data approach to the determinants of Belgian consumer price changes,"Aucremanne, Luc & Dhyne, Emmanuel"
461,Do decreasing hazard functions for price changes make any sense?,"Álvarez, Luis J. & Burriel, Pablo & Hernando, Ignacio"
460,"Part-time work in EU countries: labour market mobility, entry and exit","Mourre, Gilles & Buddelmeyer, Hielke & Ward-Warmedinger, Melanie"
459,"Capital flows and the US ""New Economy"": consumption smoothing and risk exposure","Miller, Marcus & Castrén, Olli & Zhang, Lei"
458,Money demand and macroeconomic stability revisited,"Schabert, Andreas & Stoltenberg, Christian"
457,"Transparency, disclosure and the federal reserve","Ehrmann, Michael & Fratzscher, Marcel"
456,The French block of the ESCB multi-country model,"Villetelle, Jean-Pierre & Boissay, Frédéric"
455,Central bank transparency and private information in a dynamic macroeconomic model,"Pearlman, Joseph G."
454,European women: Why do(n't) they work?,"Genre, Véronique & Gómez-Salvador, Ramón & Lamo, Ana"
453,Does product market competition reduce inflation? Evidence from EU countries and sectors,"Przybyla, Marcin & Roma, Moreno"
452,"Stocks, bonds, money markets and exchange rates: measuring international financial transmission","Ehrmann, Michael & Fratzscher, Marcel & Rigobon, Roberto"
451,Breaks in the mean of inflation: how they happen and what to do with them,"Corvoisier, Sandrine & Mojon, Benoît"
450,Using mean reversion as a measure of persistence,"Robalo Marques, Carlos & Dias, Daniel"
449,Consumer price behaviour in Italy: evidence from micro CPI data,"Veronese, Giovanni & Fabiani, Silvia & Gattulli, Angela & Sabbatini, Roberto"
448,Price-setting behaviour in Belgium: what can be learned from an ad hoc survey?,"Aucremanne, Luc & Druant, Martine"
447,Foreign exchange option and returns based correlation forecasts: evaluation and two applications,"Castrén, Olli & Mazzotta, Stefano"
446,Trade effects of the euro: evidence from sectoral data,"Baldwin, Richard E. & Skudelny, Frauke & Taglioni, Daria"
445,Welfare implications of joining a common currency,"Ca' Zorzi, Michele & De Santis, Roberto A. & Zampolli, Fabrizio"
444,"Keeping up with the Joneses, reference dependence, and equilibrium indeterminacy","al-Nowaihi, Ali & Stracca, Livio"
443,Explaining cross-border large-value payment flows: evidence from TARGET and EURO 1 data,"Rosati, Simonetta & Secola, Stefania"
442,Why do financial systems differ? History matters,"Monnet, Cyril & Quintin, Erwan"
441,The Phillips curve and long-term unemployment,"Llaudes, Ricardo"
440,Estimating and analysing currency options implied risk-neutral density functions for the largest new EU member states,"Castrén, Olli"
439,A look at intraday frictions in the euro area overnight deposit market,"Brousseau, Vincent & Manzanares, Andrés"
438,Quality of public finances and growth,"Schuknecht, Ludger & Ebert, Werner & Thöne, Michael & Afonso, António"
437,"What drives international bank flows? Politics, institutions and other determinants","Papaioannou, Elias"
436,Measuring market and inflation risk premia in France and in Germany,"Cappiello, Lorenzo & Guéné, Stéphane"
435,Reforming public expenditure in industrialised countries: are there trade-offs?,"Schuknecht, Ludger & Tanzi, Vito"
434,Interest rates and output in the long-run,"Aksoy, Yunus & León-Ledesma, Miguel A."
433,Implementing the stability and growth pact: enforcement and procedural flexibility,"Beetsma, Roel & Debrun, Xavier"
432,Trading European sovereign bonds: the microstructure of the MTS trading platforms,"Cheung, Yiu Chung & de Jong, Frank & Rindi, Barbara"
431,Regulation of multinational banks: a theoretical inquiry,"Calzolari, Giacomo & Loranth, Gyongyi"
430,Public policy and the creation of active venture capital markets,"Da Rin, Marco & Nicodano, Giovanna & Sembenelli, Alessandro"
429,Cross-border diversification in bank asset portfolios,"Buch, Claudia M. & Driscoll, John C. & Ostergaard, Charlotte"
428,Who benefits from IPO underpricing? Evidence form hybrid bookbuilding offerings,"Pons-Sanz, Vicente"
427,Interlinking securities settlement systems: a strategic commitment?,"Kauko, Karlo"
426,Security fungibility and the cost of capital: evidence from global bonds,"Miller, Darius P. & Puthenpurackal, John J."
425,Geographic versus industry diversification: constraints matter,"Ehling, Paul & Ramos, Sofia Brito"
424,An empirical study of liquidity and information effects of order flow on exchange rates,"Breedon, Francis & Vitale, Paolo"
423,Price setting in France: new evidence from survey data,"Loupias, Claire & Ricart, Roland"
422,What determines fiscal balances? An empirical investigation in determinants of changes in OECD budget balances,"Tujula, Mika & Wolswijk, Guido"
421,EU fiscal rules: issues and lessons from political economy,"Schuknecht, Ludger"
420,On prosperity and posterity: the need for fiscal discipline in a monetary union,"Detken, Carsten & Winkler, Bernhard & Gaspar, Ví­tor"
419,The design of fiscal rules and forms of governance in European Union countries,"Strauch, Rolf & Hallerberg, Mark & von Hagen, Jürgen"
418,Identifying the influences of nominal and real rigidities in aggregate price-setting behavior,"Levin, Andrew T. & Coenen, Günter"
417,Staggered price contracts and inflation persistence: some general results,"Whelan, Karl"
416,Price setting behaviour in Spain: stylised facts using consumer price micro data,"Hernando, Ignacio & Álvarez, Luis J."
415,How persistent is disaggregate inflation? An analysis across EU 15 countries and HICP sub-indices,"Lünnemann, Patrick & Mathä, Thomas Y."
414,"Inflation persistence in the European Union, the euro area, and the United States","Gadzinski, Gregory & Orlandi, Fabrice"
413,An empirical analysis of price setting behaviour in the Netherlands in the period 1998-2003 using micro data,"Jonker, Nicole & Folkertsma, Carsten & Blijenberg, Harry"
412,The real effects of money growth in dynamic general equilibrium,"Graham, Liam & Snower, Dennis J."
411,Fiscal discipline and the cost of public dept service: some estiames for OECD countries,"Ardagna, Silvia & Caselli, Francesco & Lane, Timothy"
410,Do options-implied RND functions on G3 currencies move around the times of interventions on the JPY/USD exchange rate?,"Castrén, Olli"
409,"Currency mismatch, uncertainty and debt maturity structure","Fratzscher, Marcel & Bussière, Matthieu & Koeniger, Winfried"
408,"The great inflation, limited asset markets participation and aggregate demand: FED policy was better than you think","Bilbiie, Florin O."
407,Banking consolidation and small business lending,"Takáts, Elöd"
406,Labour market reform and the sustainability of exchange rate pegs,"Takalo, Tuomas & Castrén, Olli & Wood, Geoffrey"
405,A joint econometric model of macroeconomic and term structure dynamics,"Tristani, Oreste & Vestin, David & Hördahl, Peter"
404,An analysis of systemic risk in alternative securities settlement architectures,"Iori, Giulia"
403,Financial market integration and loan competition: when is entry deregulation socially beneficial?,"Kaas, Leo"
402,Forecasting euro area inflation using dynamic factor measures of underlying inflation,"Camba-Méndez, Gonzalo & Kapetanios, George"
401,Foreign direct investment and international business cycle comovement,"Jansen, W. Jos & Stokman, Ad C.J."
400,Cross-country differences in monetary policy transmission,"Morgan, Julian & Locarno, Alberto & Vallés, Javier & Berben, Robert-Paul"
399,Sporadic manipulation in money markets with central bank standing facilities,"Cassola, Nuno & Ejerskov, Steen & Ewerhart, Christian & Valla, Natacha"
398,Mergers and acquisitions and bank performance in Europe: the role of strategic similarities,"Altunbas, Yener & Marqués-Ibáñez, David"
397,Determinants of euro term structure of credit spreads,"Van Landschoot, Astrid"
396,The short-term impact of government budgets on prices: evidence from macroeconomic models,"Henry, Jérôme & Hernández de Cos, Pablo & Momigliano, Sandro"
395,Fiscal sustainability and public debt in an endogenous growth model,"Vidal, Jean-Pierre & Fernández-Huertas Moraga, Jesús"
394,"Liquidity, money creation and destruction, and the returns to banking","de O. Cavalcanti, Ricardo & Erosa, Andrés & Temzelides, Ted"
393,The determinants of the overnight interest rate in the euro area,"Moschitz, Julius"
392,The role of central bank capital revisited,"Bindseil, Ulrich & Manzanares, Andrés & Weller, Benedict"
391,Comparing shocks and frictions in US and euro area business cycles: a Bayesian DSGE approach,"Smets, Frank & Wouters, Raf"
390,Financial markets' behavior around episodes of large changes in the fiscal stance,"Ardagna, Silvia"
389,Forecasting with a Bayesian DSGE model: an application to the euro area,"Smets, Frank & Wouters, Raf"
388,Euro area inflation differentials,"Angeloni, Ignazio & Ehrmann, Michael"
387,Horizontal and vertical integration and securities trading and settlement,"Tapking, Jens & Yang, Jing"
386,Intergenerational altruism and neoclassical growth models,"Michel, Philippe & Vidal, Jean-Pierre & Thibault, Emmanuel"
385,Euro area sovereign yield dynamics: the role of order imbalance,"Menkveld, Albert J. & Cheung, Yiu Chung & de Jong, Frank"
384,Price rigidity. Evidence from the French CPI micro-data,"Sevestre, Patrick & Baudry, Laurent & Le Bihan, Hervé & Tarrieu, Sylvie"
383,Explicit inflation objectives and macroeconomic outcomes,"Levin, Andrew T. & Piger, Jeremy M. & Natalucci, Fabio M."
382,"Longer-term effects of monetary growth on real and nominal variables, major industrial countries, 1880-2001","Dewald, William G. & Haug, Alfred A."
381,Fiscal rules and sustainability of public finances in an endogenous growth model,"Giammarioli, Nicola & Annicchiarico, Barbara"
380,Optimal monetary policy under discretion with a zero bound on nominal interest rates,"Adam, Klaus & Billi, Roberto M."
379,Do financial market variables show (symmetric) indicator properties relative to exchange rate returns?,"Castrén, Olli"
378,"Liquidity, information, and the overnight rate","Cassola, Nuno & Ejerskov, Steen & Ewerhart, Christian & Valla, Natacha"
377,Optimal monetary policy under commitment with a zero bound on nominal interest rates,"Adam, Klaus & Billi, Roberto M."
376,Raising rival's costs in the securities settlement industry,"Holthausen, Cornelia & Tapking, Jens"
375,Guess what: it's the settlements!,"Monnet, Cyril & Koeppl, Thorsten Volker"
374,To aggregate or not to aggregate? Euro area inflation forecasting,"Roma, Moreno & Skudelny, Frauke & Benalal, Nicholai & Diaz del Hoyo, Juan Luis & Landau, Bettina"
373,Technology shocks and robust sign restrictions in a euro area SVAR,"Peersman, Gert & Straub, Roland"
372,The operational target of monetary policy and the rise and fall of reserve position doctrine,"Bindseil, Ulrich"
371,Inflation persistence: facts or artefacts?,"Robalo Marques, Carlos"
370,Inflation persistence during periods of structural change: an assessment using Greek data,"Hondroyiannis, George & Lazaretou, Sophia"
369,Sovereign risk premia in the European government bond market,"Schuknecht, Ludger & von Hagen, Jürgen & Bernoth, Kerstin"
368,Capital quality improvement and the sources of growth in the euro area,"Sakellaris, Plutarchos & Vijselaar, Focco"
367,Factor substitution and factor augmenting technical progress in the US: a normalized supply-side system approach,"Klump, Rainer & McAdam, Peter & Willman, Alpo"
366,The informational content of over-the-counter currency options,"Christoffersen, Peter & Mazzotta, Stefano"
365,Exchange rates and fundamentals: new evidence from real-time data,"Ehrmann, Michael & Fratzscher, Marcel"
364,Asset price booms and monetary policy,"Detken, Carsten & Smets, Frank"
363,Communication and exchange rate policy,"Fratzscher, Marcel"
362,Oil price shocks and real GDP growth: empirical evidence for some OECD countries,"Jiménez-Rodríguez, Rebeca & Sánchez, Marcelo"
361,Excess reserves and implementation of monetary policy of the ECB,"Bindseil, Ulrich & Camba-Méndez, Gonzalo & Hirsch, Astrid & Weller, Benedict"
360,Optimal monetary policy rules for the euro area: an analysis using the area wide model,"Dieppe, Alistair & Kuester, Keith & McAdam, Peter"
359,The longer term refinancing operations of the ECB,"Linzert, Tobias & Nautz, Dieter & Bindseil, Ulrich"
358,Did the pattern of aggregate employment growth change in the euro area in the late 1990s?,"Mourre, Gilles"
357,Seasonal adjustment and the detection of business cycle phases,"Matas Mir, Antonio & Osborn, Denise R"
356,Developing a euro area accounting matrix: issues and applications,"McAdam, Peter & Jellema, Tjeerd & Keuning, Steven & Mink, Reimund"
355,Production interdependence and welfare,"Huang, Kevin X. D. & Liu, Zheng"
354,Taking stock: monetary policy transmission to equity markets,"Ehrmann, Michael & Fratzscher, Marcel"
353,Towards the estimation of equilibrium exchange rates for CEE acceding countries: methodological issues and a panel cointegration perspective,"Maeso-Fernandez, Francisco & Osbat, Chiara & Schnatz, Bernd"
352,Forecasting inflation with thick models and neural networks,"McAdam, Peter & McNelis, Paul"
351,Interest rate determination in the interbank market,"Gaspar, Ví­tor & Pérez Quirós, Gabriel & Rodríguez Mendizábal, Hugo"
350,Exchange-rate policy and the zero bound on nominal interest rates,"Coenen, Günter & Wieland, Volker"
349,Estimating the rank of the spectral density matrix,"Camba-Méndez, Gonzalo & Kapetanios, George"
348,"Financial openness and growth: short-run gain, long-run pain?","Fratzscher, Marcel & Bussière, Matthieu"
347,Firms' investment decisions in response to demand and price uncertainty,"Fuss, Catherine & Vermeulen, Philip"
346,Perpetual youth and endogenous labour supply: a problem and a possible solution,"Ascari, Guido & Rankin, Neil"
345,Optimal monetary and fiscal policy: a linear-quadratic approach,"Benigno, Pierpaolo & Woodford, Michael"
344,Ramsey monetary policy and international relative prices,"Faia, Ester & Monacelli, Tommaso"
343,"Monetary discretion, pricing complementarity and dynamic multiple equilibria","King, Robert G. & Wolman, Alexander L."
342,"Equal size, equal role? Interdependence between the euro area and the United States","Ehrmann, Michael & Fratzscher, Marcel"
341,Benefits and spillovers of greater competition in Europe: a macroeconomic assessment,"Bayoumi, Tamim & Laxton, Douglas & Pesenti, Paolo"
340,Indeterminacy with inflation-forecast-based rules in a two-bloc model,"Batini, Nicoletta & Levine, Paul & Pearlman, Joseph G."
339,Understanding the effects of government spending on consumption,"Galí, Jordi & López-Salido, David & Vallés, Javier"
338,The optimal degree of discretion in monetary policy,"Athey, Susan & Atkeson, Andrew & Kehoe, Patrick J."
337,"The decline of activist stabilization policy: natural rate misperceptions, learning, and expectations","Orphanides, Athanasios & Williams, John C."
336,The great inflation of the 1970s,"Collard, Fabrice & Dellas, Harris"
335,Has euro-area inflation persistence changed over time?,"O'Reilly, Gerard & Whelan, Karl"
334,Is inflation persistence intrinsic in industrial economies?,"Levin, Andrew T. & Piger, Jeremy M."
333,The pricing behaviour of Italian firms: new survey evidence on price stickiness,"Fabiani, Silvia & Gattulli, Angela & Sabbatini, Roberto"
332,Stylised features of price setting behaviour in Portugal: 1992-2001,"Dias, Mónica & Dias, Daniel & Neves, Pedro D."
331,How frequently do prices change? Evidence based on the micro data underlying the Belgian CPI,"Aucremanne, Luc & Dhyne, Emmanuel"
330,"The demand for euro area currencies: past, present and future","Seitz, Franz & Fischer, Björn & Köhler, Petra"
329,On the determinants of euro area FDI to the United States: the knowledge- capital-Tobin's Q framework,"Anderton, Robert & Hijzen, Alexander & De Santis, Roberto A."
328,Non-fundamental exchange rate volatility and welfare,"Straub, Roland & Tchakarov, Ivan"
327,Diversification in euro area stock markets: country versus industry,"Moerman, Gerard"
326,The Great Depression and the Friedman-Schwartz hypothesis,"Christiano, Lawrence & Motto, Roberto & Rostagno, Massimo"
325,What are the spill-overs from fiscal shocks in Europe? An empirical analysis,"Giuliodori, Massimo & Beetsma, Roel"
324,Fundamentals and joint currency crises,"Hartmann, Philipp & Straetmans, Stefan & de Vries, Casper"
323,On the indeterminacy of new-Keynesian economics,"Beyer, Andreas & Farmer, Roger E. A."
322,Modelling inflation in the euro area,"Jansen, Eilev S."
321,Frequency domain principal components estimation of fractionally cointegrated processes,"Morana, Claudio"
320,Institutions and service employment: a panel study for OECD countries,"Messina, Julián"
319,Risk sharing through financial markets with endogenous enforcement of trades,"Koeppl, Thorsten Volker"
318,Gross job flows and institutions in Europe,"Gómez-Salvador, Ramón & Messina, Julián & Vallanti, Giovanna"
