ID,Title,Author
1172,"Size, openness, and macroeconomic interdependence","Chudik, Alexander & Straub, Roland"
1171,The external finance premium in the euro area A useful indicator for monetary policy?,"Gelain, Paolo"
1170,Global commodity cycles and linkages a FAVAR approach,"Lombardi, Marco J. & Osbat, Chiara & Schnatz, Bernd"
1169,The impact of numerical expenditure rules on budgetary discipline over the cycle,"Holm-Hadulla, Fédéric & Hauptmeier, Sebastian & Rother, Philipp"
1168,Food price pass-through in the euro area The role of asymmetries and non-linearities,"Ferrucci, Gianluigi & Jiménez-Rodríguez, Rebeca & Onorante, Luca"
1167,Macroeconomic forecasting and structural change,"Gambetti, Luca & D’Agostino, Antonello & Giannone, Domenico"
1166,Does monetary policy affect bank risk-taking?,"Altunbas, Yener & Gambacorta, Leonardo & Marqués-Ibáñez, David"
1165,The term structure of risk premia: new evidence from the financial crisis,"Berg, Tobias"
1164,"Price, wage and employment response to shocks: evidence from the WDN survey","Bertola, Giuseppe & Dabusinskas, Aurelijus & Hoeberichts, Marco M. & Izquierdo, Mario & Kwapil, Claudia & Montornès, Jérémi & Radowski, Daniel"
1163,"Asset pricing, habit memory, and the labor market","Jaccard, Ivan"
1162,Inflation risks and inflation risk premia,"García, Juan Angel & Werner, Thomas"
1161,"Housing, consumption and monetary policy: how different are the US and the euro area?","Musso, Alberto & Neri, Stefano & Stracca, Livio"
1160,The euro area Bank Lending Survey matters: empirical evidence for credit and output growth,"de Bondt, Gabe & Maddaloni, Angela & Peydró, José-Luis & Scopel, Silvia"
1159,Wages and the risk of displacement,"Carneiro, Anabela & Portugal, Pedro"
1158,Excess returns on net foreign assets: the exorbitant privilege from a global perspective,"Habib, Maurizio Michael"
1157,Real time estimates of the euro area output gap: reliability and forecasting performance,"Marcellino, Massimiliano & Musso, Alberto"
1156,Mortgage indebtedness and household financial distress,"Georgarakos, Dimitris & Lojschová, Adriana & Ward-Warmedinger, Melanie"
1155,Combining disaggregate forecasts or combining disaggregate information to forecast an aggregate,"Hendry, David F. & Hubrich, Kirstin"
1154,Public and private inputs in aggregate production and growth: a cross-country efficiency approach,"Afonso, António & St. Aubyn, Miguel"
1153,The determination of wages of newly hired employees: survey evidence on internal versus external factors,"Galuščák, Kamil & Keeney, Mary & Nicolitsas, Daphne & Smets, Frank & Strzelecki, Pawel & Vodopivec, Matija"
1152,Government bond risk premiums in the EU revisited: the impact of the financial crisis,"Schuknecht, Ludger & von Hagen, Jürgen & Wolswijk, Guido"
1151,Methodological advances in the assessment of equilibrium exchange rates,"Bussière, Matthieu & Ca' Zorzi, Michele & Chudik, Alexander & Dieppe, Alistair"
1150,Do bank loans and credit standards have an effect on output? A panel approach for the euro area,"Cappiello, Lorenzo & Kadareja, Arjan & Kok, Christoffer & Protopapa, Marco"
1149,Does it matter how aggregates are measured? The case of monetary transmission mechanisms in the euro area,"Beyer, Andreas & Juselius, Katarina"
1148,Is there a signalling role for public wages? Evidence for the euro area based on macro data,"Pérez, Javier J. & Sánchez, Jesús"
1147,Interbank contagion at work: evidence from a natural experiment,"Iyer, Rajkamal & Peydró, José-Luis"
1146,The role of central bank transparency for guiding private sector forecasts,"Ehrmann, Michael & Eijffinger, Sylvester & Fratzscher, Marcel"
1145,An area-wide real-time database for the euro area,"Giannone, Domenico & Henry, Jérôme & Lalik, Magdalena & Modugno, Michele"
1144,Choosing and using payment instruments: evidence from German microdata,"Von Kalckreuth, Ulf & Schmidt, Tobias & Stix, Helmut"
1143,What drives the network’s growth? An agent-based study of the payment card market,"Alexandrova-Kabadjova, Biliana & Negrín, José Luis"
1142,Credit card use after the final mortgage payment: does the magnitude of income shocks matter?,"Scholnick, Barry"
1141,How effective are rewards programs in promoting payment card usage? empirical evidence,"Carbó-Valverde, Santiago & Liñares-Zegarra, José M."
1140,"SEPA, efficiency, and payment card competition","Bolt, Wilko & Schmiedel, Heiko"
1139,Pricing payment cards,"Bedre-Defolie, Özlem & Calvano, Emilio"
1138,Credit card interchange fees,"Rochet, Jean-Charles & Wright, Julian"
1137,Regulating two-sided markets: an empirical investigation,"Carbó-Valverde, Santiago & Chakravorti, Sujit & Rodríguez Fernández, Francisco"
1136,"Payment scale economies, competition, and pricing","Humphrey, David"
1135,Return to retail banking and payments,"Hasan, Iftekhar & Schmiedel, Heiko & Song, Liang"
1134,Would the Bundesbank have prevented the Great Inflation in the United States?,"Benati, Luca"
1133,Fiscal policy shocks in the euro area and the US: an empirical assessment,"Burriel, Pablo & de Castro Fernández, Francisco & Garrote, Daniel & Gordo, Esther & Paredes, Joan & Pérez, Javier J."
1132,A quarterly fiscal database for the euro area based on intra-annual fiscal information,"Paredes, Joan & Pedregal, Diego J. & Pérez, Javier J."
1131,What explains the surge in euro area sovereign spreads during the financial crisis of 2007-09?,"Attinasi, Maria Grazia & Checherita-Westphal, Cristina & Nickel, Christiane"
1130,Monetary policy and potential output uncertainty: a quantitative assessment,"Delle Chiaie, Simona"
1129,Determinants of inflation and price level differentials across the euro area countries,"Andersson, Malin & Masuch, Klaus & Schiffbauer, Marc"
1128,EMU and the adjustment to asymmetric shocks: the case of Italy,"Amisano, Gianni & Giammarioli, Nicola & Stracca, Livio"
1127,The Janus-headed salvation: sovereign and bank credit risk premia during 2008-09,"Ejsing, Jacob & Lemke, Wolfgang"
1126,Liquidity hoarding and interbank market spreads: the role of counterparty risk,"Heider, Florian & Hoerova, Marie & Holthausen, Cornelia"
1125,Leading indicators in a globalised world,"Fichtner, Ferdinand & Rüffer, Rasmus & Schnatz, Bernd"
1124,Balance Sheet Interlinkages and Macro-Financial Risk Analysis in the Euro Area,"Castrén, Olli & Kavonius, Ilja Kristian"
1123,Monetary Policy and the Financing of Firms,"De Fiore, Fiorella & Teles, Pedro & Tristani, Oreste"
1122,Monetary Policy Shocks and Portfolio Choice,"Fratzscher, Marcel & Saborowski, Christian & Straub, Roland"
1121,"Does Finance Bolster Superstar Companies? Banks, Venture Capital, and Firm Size in Local U.S. Markets","Popov, Alexander"
1120,Exchange Rate Pass-through in Central and Eastern European Member States,"Bijsterbosch, Martin & Beirne, John"
1119,Nonparametric Hybrid Phillips Curves Based on Subjective Expectations: Estimates for the Euro Area,"Gross, Marco"
1118,Discretionary Fiscal Policies over the Cycle: New Evidence based on the ESCB Disaggregated Approach,"Agnello, Luca & Cimadomo, Jacopo"
1117,What Drives Personal Consumption? The Role of Housing and Financial Wealth,"Slacalek, Jiri"
1116,Sectorial Border Effects in the European Single Market: an Explanation through Industrial Concentration,"Cafiso, Gianluca"
1115,Estimation and forecasting in large datasets with conditionally heteroskedastic dynamic common factors,"Alessi, Lucia & Barigozzi, Matteo & Capasso, Marco"
1114,Explaining government revenue windfalls and shortfalls: an analysis for selected EU countries,"Morris, Richard & de Castro Fernández, Francisco & Jonk, Steven & Kremer, Jana & Linehan, Suzanne & Marino, Maria Rosaria & Schalck, Christophe & Tkačevs, Olegs"
1113,Volatility spillovers and contagion from mature to emerging stock markets,"Beirne, John & Caporale, Guglielmo Maria & Schulze-Ghattas, Marianne & Spagnolo, Nicola"
1112,Risk spillover among hedge funds: The role of redemptions and fund failures,"Klaus, Benjamin & Rzepkowski, Bronka"
1111,A Stable Model for Euro Area Money Demand: Revisiting the Role of Wealth,"Beyer, Andreas"
1110,Putting the New Keynesian DSGE model to the real-time forecasting test,"Kolasa, Marcin & Rubaszek, Michał & Skrzypczyński, Paweł"
1109,What Triggers Prolonged Inflation Regimes? A Historical Analysis,"Vansteenkiste, Isabel"
1108,The role of financial variables in predicting economic activity,"Espinoza, Raphael & Fornari, Fabio & Lombardi, Marco J."
1107,"Interbank lending, credit risk premia and collateral","Heider, Florian & Hoerova, Marie"
1106,The margins of labour cost adjustment: survey evidence from European firms,"Babecký, Jan & Du Caju, Philip & Kosma, Theodora & Lawless, Martina & Messina, Julián & Rõõm, Tairi"
1105,Downward Nominal and Real Wage Rigidity: Survey Evidence from European Firms,"Babecký, Jan & Du Caju, Philip & Kosma, Theodora & Lawless, Martina & Messina, Julián & Rõõm, Tairi"
1104,Pass-through of external shocks along the pricing chain: A panel estimation approach for the euro area,"Landau, Bettina & Skudelny, Frauke"
1103,Inter-industry wage differentials: how much does rent sharing matter?,"Du Caju, Philip & Rycx, François & Tojerow, Ilan"
1102,Wage-setting behavior in France: additional evidence from an ad-hoc survey,"Montornès, Jérémi & Sauner-Leroy, Jacques-Bernard"
1101,Fiscal variables and bond spreads: evidence from eastern European countries and Turkey,"Nickel, Christiane & Rother, Philipp & Rülke, Jan C."
1100,Weak and strong cross section dependence and estimation of large panels,"Chudik, Alexander & Pesaran, Hashem & Tosetti, Elisa"
1099,Public and private sector wages interactions in a general equilibrium model,"Fernàndez-de-Córdoba, Gonzalo & Pérez, Javier J. & Torres, José L."
1098,Gauging the effectiveness of quantitative forward guidance: evidence from three inflation targeters,"Andersson, Magnus & Hofmann, Boris"
1097,Monetary and fiscal policy aspects of indirect tax changes in a monetary union,"von Thadden, Leopold & Lipińska, Anna"
1096,The determinants of bank capital structure,"Gropp, Reint & Heider, Florian"
1095,Memories of high inflation,"Ehrmann, Michael & Tzamourani, Panagiota"
1094,Signals from housing and lending booms,"Bunda, Irina & Ca' Zorzi, Michele"
1093,Determinants of government bond spreads in new EU countries,"Alexopoulou, Ioana & Bunda, Irina & Ferrando, Annalisa"
1092,Inflation and output volatility under asymmetric incomplete information,"Carboni, Giacomo & Ellison, Martin"
1091,Money talks,"Hoerova, Marie & Monnet, Cyril & Temzelides, Ted"
1090,New Keynesian versus old Keynesian government spending multipliers,"Cogan, John F. & Cwik, Tobias & Taylor, John B. & Wieland, Volker"
1089,The effects of monetary policy on unemployment dynamics under model uncertainty: evidence from the US and the euro area,"Altavilla, Carlo & Ciccarelli, Matteo"
1088,Inflation perceptions and expectations in the euro area: the role of news,"Badarinza, Cristian & Gross, Marco"
1087,Modelling global trade flows: results from a GVAR model,"Bussière, Matthieu & Chudik, Alexander & Sestieri, Giulia"
1086,Euro area money demand: empirical evidence on the role of equity and labour markets,"de Bondt, Gabe"
1085,An empirical study on the decoupling movements between corporate bond and CDS spreads,"Andersson, Magnus & Alexopoulou, Ioana & Georgescu, Oana-Maria"
1084,How are firms' wages and prices linked: survey evidence in Europe,"Fabiani, Silvia & Martins, Fernando & Druant, Martine & Sabbatini, Roberto & Lamo, Ana & Kézdi, Gábor"
1083,Evaluating microfoundations for aggregate price regidities: evidence from matched firm-level data on product prices and unit labor cost,"Carlsson, Mikael & Nordström Skans, Oskar"
1082,Disagreement among forecasters in G7 countries,"Dovern, Jonas & Fritsche, Ulrich & Slacalek, Jiri"
1081,Liquidity premia in German government bonds,"Ejsing, Jacob & Sihvonen, Jukka"
1080,Productivity and job flows: heterogeneity of new hires and continuing jobs in the business cycle,"Kilponen, Juha & Vanhala, Juuso"
1079,EMU and European government bond market integration,"Abad, Pilar & Chuliá, Helena & Gómez-Puig, Marta"
1078,On the real effects of private equity investment: evidence from new business creation,"Popov, Alexander & Roosenboom, Peter"
1077,The reception of public signals in financial markets - what if central bank communication becomes stale?,"Ehrmann, Michael & Sondermann, David"
1076,Optimal monetary policy in a new Keynesian model with habits in consumption,"Leith, Campbell & Moldovan, Ioana & Rossi, Raffaele"
1075,Bank risk and monetary policy,"Altunbas, Yener & Gambacorta, Leonardo & Marqués-Ibáñez, David"
1074,Wages are flexible aren't they? Evidence from monthly micro wage data,"Lünnemann, Patrick & Wintr, Ladislav"
1073,Can non-linear real shocks explain the persistence of PPP exchange rate disequilibria?,"Peltonen, Tuomas & Sager, Michael & Popescu, Adina"
1072,How important are common factors in driving non-fuel commodity prices? A dynamic factor analysis,"Vansteenkiste, Isabel"
1071,Booms and busts in housing markets: determinants and implications,"Agnello, Luca & Schuknecht, Ludger"
1070,Monetary Policy Committees: meetings and outcomes,"Berk, Jan Marc & Bierut, Beata K."
1069,Housing finance and monetary policy,"Calza, Alessandro & Monacelli, Tommaso & Stracca, Livio"
1068,Asset price misalignments and the role of money and credit,"Gerdesmeier, Dieter & Roffia, Barbara & Reimers, Hans-Eggert"
1067,The dynamic effects of shocks to wages and prices in the United States and the euro area,"Marques, Carlos Robalo & Duarte, Rita"
1066,Universal banks and corporate control: evidence from the global syndicated loan market,"Ferreira, Miguel A. & Matos, Pedro"
1065,Monetary policy and inflationary shocks under imperfect credibility,"Darracq Pariès, Matthieu & Moyen, Stéphane"
1064,Does it pay to have the euro? Italy’s politics and financial markets under the lira and the euro,"Fratzscher, Marcel & Stracca, Livio"
1063,Does private equity investment spur innovation? Evidence from Europe,"Popov, Alexander & Roosenboom, Peter"
1062,External shocks and international inflation linkages: a global VAR analysis,"Lombardi, Marco J. & Galesi, Alessandro"
1061,The distribution of households consumption-expenditure budget shares,"Barigozzi, Matteo & Alessi, Lucia & Capasso, Marco & Fagiolo, Giorgio"
1060,What explains global exchange rate movements during the financial crisis?,"Fratzscher, Marcel"
1059,Forecasting the world economy in the short-term,"Jakaitiene, Audrone & Dées, Stéphane"
1058,National prices and wage setting in a currency union,"Sánchez, Marcelo"
1057,Euro area private consumption: Is there a role for housing wealth effects,"Skudelny, Frauke"
1056,The pricing of subprime mortgage risk in good times and bad: evidence from the ABX.HE indices,"Scheicher, Martin & Fender, Ingo"
1055,The impact of extreme weather events on budget balances and implications for fiscal policy,"Lis, Eliza & Nickel, Christiane"
1054,"Fiscal behaviour in the European Union: rules, fiscal decentralization and government indebtedness","Afonso, António & Hauptmeier, Sebastian"
1053,Inflation dynamics with labour market matching: assessing alternative specifications,"Christoffel, Kai & Costain, James & de Walque, Gregory & Kuester, Keith & Linzert, Tobias & Millard, Stephen & Pierrard, Olivier"
1052,Bidding behaviour in the ECB's main refinancing operations during the financial crisis,"Eisenschmidt, Jens & Hirsch, Astrid & Linzert, Tobias"
1051,"Are more data always better for factor analysis? Results for the euro area, the six largest euro area countries and the UK","Caggiano, Giovanni & Kapetanios, George & Labhard, Vincent"
1050,Wealth effects on consumption: evidence from the euro area,"Sousa, Ricardo M."
1049,Labour force participation in the euro area: a cohort based analysis,"Balleer, Almut & Gómez-Salvador, Ramón & Turunen, Jarkko"
1048,Downward wage rigidity and optimal steady-state inflation,"Fagan, Gabriel & Messina, Julián"
1047,The impact of reference norms on inflation persistence when wages are staggered,"Knell, Markus & Stiglbauer, Alfred"
1046,Productivity shocks and real exchange rate: a reappraisal,"Peltonen, Tuomas & Sager, Michael"
1045,The term structure of equity premia in an affine arbitrage-free model of bond and stock market dynamics,"Werner, Thomas & Lemke, Wolfgang"
1044,The forecasting power of internal yield curve linkages,"Nikolaou, Kleopatra & Modugno, Michele"
1043,Optimal monetary policy in a model of the credit channel,"De Fiore, Fiorella & Tristani, Oreste"
1042,The determinants of public deficit volatility,"Agnello, Luca & Sousa, Ricardo M."
1041,An economic capital model integrating credit and interest rate risk in the banking book,"Drehmann, Mathias & Alessandri, Piergiorgio"
1040,The external and domestic side of macroeconomic adjustment in China,"Thimann, Christian & Straub, Roland"
1039,'Real time'early warning indicators for costly asset price boom/bust cycles: a role for global liquidity,"Detken, Carsten & Alessi, Lucia"
1038,Are 'intrinsic inflation persistence' models structural in the sense of Lucas (1976)?,"Benati, Luca"
1037,What do asset prices have to say about risk appetite and uncertainty?,"Bekaert, Geert & Hoerova, Marie & Scheicher, Martin"
1036,Search in the product market and the real business cycle,"Mathä, Thomas Y. & Pierrard, Olivier"
1035,The role of labor markets for euro area monetary policy,"Linzert, Tobias & Christoffel, Kai & Kuester, Keith"
1034,The role of the United States in the global economy and its evolution over time,"Dées, Stéphane & Saint-Guilhem, Arthur"
1033,Fiscal competition over taxes and public inputs - theory and evidence,"Hauptmeier, Sebastian & Mittermaier, Ferdinand & Rincke, Johannes"
1032,Assessing long-term fiscal developments - a new approach,"Afonso, António & Furceri, Davide & Agnello, Luca & Sousa, Ricardo M."
1031,Global roles of currencies,"Thimann, Christian"
1030,Forecast evaluation of small nested model sets,"Hubrich, Kirstin & West, Kenneth D."
1029,The role of fiscal transfers for regional economic convergence in Europe,"Nickel, Christiane & Checherita-Westphal, Cristina & Rother, Philipp"
1028,Large debt financing: syndicated loans versus corporate bonds,"Altunbas, Yener & Kara, Alper & Marqués-Ibáñez, David"
1027,Long run evidence on money growth and inflation,"Benati, Luca"
1026,Do house price developments spill over across euro area countries? Evidence from a Global VAR,"Hiebert, Paul & Vansteenkiste, Isabel"
1025,Liquidity risk premia in unsecured interbank money markets,"Tapking, Jens & Eisenschmidt, Jens"
1024,Funding liquidity risk: definition and measurement,"Nikolaou, Kleopatra & Drehmann, Mathias"
1023,Bank loan announcements and borrower stock returns: does bank origin matter?,"Ongena, Steven & Roscovan, Viorel"
1022,Understanding inter-industry wage structures in the euro area,"Genre, Véronique & Momferatou, Daphne & Kohn, Karsten"
1021,Rigid labour compensation and flexible employment? Firm-level evidence with regard to productivity for Belgium,"Fuss, Catherine & Wintr, Ladislav"
1020,Opting out of the Great Inflation: German monetary policy after the break down of Bretton Woods,"Beyer, Andreas & Gaspar, Ví­tor & Gerberding, Christina & Issing, Otmar"
1019,What drives returns to euro area housing? Evidence from a dynamic dividend-discount model,"Hiebert, Paul & Sydow, Matthias"
1018,Cross-Border Mergers and acquisitions: Financial and institutional forces,"De Santis, Roberto A. & Coeurdacier, Nicolas & Aviat, Antonin"
1017,Optimal Prediction Pools,"Amisano, Gianni & Geweke, John"
1016,When does lumpy factor adjustment matter for aggregate dynamics?,"Fahr, Stephan & Yao, Fang"
1015,Inflation forecasting in the new EU Member States,"Arratibel, Olga & Leiner-Killinger, Nadine & Kamps, Christophe"
1014,Asset prices and current account fluctuations in G7 economies,"Fratzscher, Marcel & Straub, Roland"
1013,"Structural breaks, cointegration and the Fisher effect","Beyer, Andreas & Dewald, William G. & Haug, Alfred A."
1012,Petrodollars and imports of oil exporting countries,"Kamps, Annette & Beck, Roland"
1011,The global dimension of inflation - evidence from factor-augmented Phillips curves,"Eickmeier, Sandra & Moll, Katharina"
1010,Business cycles in the euro area,"Giannone, Domenico & Reichlin, Lucrezia & Lenza, Michele"
1009,Optimal sticky prices under rational inattention,"Maćkowiak, Bartosz & Wiederholt, Mirko"
1008,Liquidity (risk) concepts: definitions and interactions,"Nikolaou, Kleopatra"
1007,Sequential bargaining in a new-Keynesian model with frictional unemployment and staggered wage negotiation,"Wouters, Raf & de Walque, Gregory & Pierrard, Olivier & Sneessens, Henri"
1006,"Understanding sectoral differences in downward real wage rigidity: workforce composition, institutions, technology and competition","Du Caju, Philip & Fuss, Catherine & Wintr, Ladislav"
1005,Labor market institutions and macroeconomic volatility in a panel of OECD countries,"Scharler, Johann & Rumler, Fabio"
1004,Characterising the inflation targeting regime in South Korea,"Sánchez, Marcelo"
1003,Real wages over the business cycle: OECD evidence from the time and frequency domains,"Messina, Julián & Turunen, Jarkko & Strozzi, Chiara"
1002,Assessing portfolio credit risk changes in a sample of EU large and complex banking groups in reaction to macroeconomic shocks,"Castrén, Olli & Fitzpatrick, Trevor & Sydow, Matthias"
1001,Identifying the elasticity of substitution with biased technical change,"McAdam, Peter & Willman, Alpo & León-Ledesma, Miguel A."
1000,Wealth effects in emerging market economies,"Peltonen, Tuomas & Sousa, Ricardo M. & Vansteenkiste, Isabel"
999,Risk-adjusted forecasts of oil prices,"Pagano, Patrizio & Pisani, Massimiliano"
998,Infinite-dimensional VARs and factor models,"Chudik, Alexander & Pesaran, Hashem"
997,Financing obstacles and growth: an analysis for euro area non-financial corporations,"Ferrando, Annalisa & Martinez-Carrascal, Carmen & Coluzzi, Chiara"
996,What drives euro area break-even inflation rates?,"Ciccarelli, Matteo & Garcí­a, Juan Angel"
995,Current account benchmarks for central and eastern Europe: a desperate search?,"Ca' Zorzi, Michele & Dieppe, Alistair & Chudik, Alexander"
994,Fiscal sustainability and policy implications for the euro area,"Balassone, Fabrizio & Cunha, Jorge & Langenus, Geert & Manzke, Bernhard & Pavot, Jeanne & Prammer, Doris & Tommasino, Pietro"
993,Has emerging Asia decoupled? An analysis of production and trade linkages using the Asian international input-output table,"Peltonen, Tuomas & Pula, Gabor"
992,FDI and productivity convergence in central and eastern Europe: an industry-level investigation,"Kolasa, Marcin & Bijsterbosch, Martin"
991,The macroeconomic effects of fiscal policy,"Afonso, António & Sousa, Ricardo M."
990,"Fiscal policy, housing and stock prices","Afonso, António & Sousa, Ricardo M."
989,Modelling loans to non-financial corporations in the euro area,"Kok, Christoffer & Rossi, Carlotta & Marqués-Ibáñez, David"
988,The interday and intraday patterns of the overnight market: evidence from an electronic platform,"Durré, Alain & Beaupain, Renaud"
987,Probability of informed trading on the euro overnight market rate: an update,"Idier, Julien & Nardelli, Stefano"
986,The topology of the federal funds market,"Bech, Morten L. & Atalay, Enghin"
985,Portuguese banks in the euro area market for daily funds,"Farinha, Luísa & Gaspar, Ví­tor"
984,The daily and policy-relevant liquidity effects,"Thornton, Daniel L."
983,What explains the spread between the euro overnight rate and the ECB's policy rate?,"Linzert, Tobias & Schmidt, Sandra"
982,Modelling short-term interest rate spreads in the euro money market,"Cassola, Nuno & Morana, Claudio"
981,Why the effective price for money exceeds the policy rate in the ECB tenders?,"Välimäki, Tuomas"
980,Extracting market expectations from yield curves augmented by money market interest rates: the case of Japan,"Nagano, Teppei & Baba, Naohiko"
979,Futures contract rates as monetary policy forecasts,"Ferrero, Giuseppe & Nobili, Andrea"
978,Measuring monetary policy expectations from financial market instruments,"Joyce, Michael A. S. & Relleen, Jonathan & Sorensen, Steffen"
977,Predictions of short-term rates and the expectations hypothesis of the term structure of interest rates,"Guidolin, Massimo & Thornton, Daniel L."
976,The term structure of interest rates across frequencies,"Assenmacher-Wesche, Katrin & Gerlach, Stefan"
975,Early estimates of euro area real GDP growth: a bottom up approach from the production side,"Hahn, Elke & Skudelny, Frauke"
974,"Institutional features of wage bargaining in 23 European countries, the US and Japan","Momferatou, Daphne & Ward-Warmedinger, Melanie & Gautier, Erwan & Du Caju, Philip"
973,Do China and oil exporters influence major currency configurations?,"Fratzscher, Marcel & Mehl, Arnaud"
972,Monetary policy and housing prices in an estimated DSGE for the US and the euro area,"Darracq Pariès, Matthieu & Notarpietro, Alessandro"
971,Interactions between private and public sector wages,"Afonso, António & Gomes, Pedro"
970,Responses to monetary policy shocks in the east and the west of Europe: a comparison,"Jarociński, Marek"
969,Comparing and evaluating Bayesian predictive distributions of assets returns,"Amisano, Gianni & Geweke, John"
968,A value at risk analysis of cedit default swaps,"Scheicher, Martin & Raunig, Burkhard"
967,Central Bank misperceptions and the role of money in interest rate rules,"Wieland, Volker & Beck, Günter W."
